{"campaign":{"campaign_id":"1b9fb01de78f38a761ebdc0c68a55e36ab90d542367c5edf539435a5b717e4ee","deadline_at":1792928781.04884,"declared_slot_seconds_reserved":424.6,"jobs_reserved":17,"schema_version":"experiment.campaign.status/0.1","status":"incomplete","steps":{"bite-default-4ff289a255a2ac75":"succeeded","bite-default-982329a8aa3b0d15":"succeeded","bite-default-f710263e96bda59b":"succeeded","bite-larger-4ff289a255a2ac75":"succeeded","bite-larger-982329a8aa3b0d15":"succeeded","bite-larger-f710263e96bda59b":"succeeded","invalid-output":"failed","lp-off-1":"succeeded","lp-off-2":"succeeded","lp-on-1":"succeeded","lp-on-2":"succeeded","numerical-check":"succeeded","prepare":"succeeded","sqp-a":"succeeded","sqp-b":"succeeded","sqp-c":"succeeded","timeout":"failed"},"stop_reason":null},"counts":{"failed":2,"succeeded":15},"provenance":{"plan_id":"b3ea8c404a321e73c509e4b456cc86d796e1221d5d43a951e0d1fba6b073a28d","runtime":{"mode":"foreground","node_id":"3dc7d7f8a855d1790655733d2b4dfd6313d23843e08641d0e9642db1043aaf71","root":"/workspace/scratch/e38cc5b491fa/iteration-06/scientific-demo/node","runner":"/workspace/scratch/e38cc5b491fa/iteration-06/baseline/bin/optimization-run","runner_file":{"bytes":3222280,"sha256":"49a7ad680bddcfb1b2d6f48e7c2f917e0bc871d299d828914178d67b4e24a978"},"workers":{"fcmaes":{"build":{"engine_version":"0.2.1","job_api_version":"0.3.0"},"digest":"0bc89497a3397756e70419b2184181e33a7374a9c6deda9a9d62e79c8a30b584","executable":"/workspace/scratch/e38cc5b491fa/iteration-06/baseline/bin/fcmaes-job-worker"},"lp-ip":{"build":{"engine_version":"0.29.0","job_api_version":"0.3.0"},"digest":"69152ec6d23299962efcfbee92f64d11b774a56168ab2e8946089a1aeea6b828","executable":"/workspace/scratch/e38cc5b491fa/iteration-06/baseline/bin/lp-ip-job-worker"},"sqp":{"build":{"engine_version":"0.17.0","job_api_version":"0.3.0"},"digest":"c1b1c4c6307896654bbcc6e81c35d0be9440ded63b91701173cc9df2b71ad631","executable":"/workspace/scratch/e38cc5b491fa/iteration-06/baseline/bin/sqp-job-worker"}}}},"schema_version":"experiment.campaign.report/0.1","steps":[{"acceptance":{},"axes":{"/payload/seed":3},"error":null,"job_id":"b6de6221a47c3acc02e1eff1e1b1b403","job_state":"completed","kind":"optimization","native":{"artifacts":{"results":"results.jsonl"},"completed_tasks":1,"elapsed_seconds":0.094261686,"known_work_lower_bound":{"evaluations":100,"validation_evaluations":1},"payload_schema":"fcmaes.retry/1","requested_tasks":1,"results":[{"elapsed_seconds":0.000560886,"outcome":{"claim":"best_found","details":{"evaluation_limit_mode":"hard","global_optimum_certified":false,"requested_evaluations":100,"run_seed":14384468101657658870},"evidence":{"checks":["objective","bounds"],"level":"rechecked"},"feasible":true,"objective":7.415380636846597e-05,"termination":"evaluation_limit","x":[0.0013003570637017958,0.008512513017631562]},"spec_digest":"6baa14020dea0cb4e8c94f875e6757abb3b373b214dd4e6fcee66fdc737ef8d8","task_id":0,"work":{"evaluations":100,"validation_evaluations":1}}],"runner":{"accounting_complete":true,"artifact_index":{"results":{"bytes":716,"description":"The result journal: one checked record per completed task","file":"results.jsonl","format":"records","sha256":"80659f829cf375b5de420f9ad96b0121820abcb45c4a1cfa337a6394add967a4"}},"attempt_id":"b6de6221a47c3acc02e1eff1e1b1b403","build":{"engine_version":"0.2.1","job_api_version":"0.3.0"},"profile":"optimization.runner/0.1","recovery":"journal_only_no_resume","resources":{"cpu_slots":1,"inner_threads":1,"outer_workers":1},"spec_digest":"6baa14020dea0cb4e8c94f875e6757abb3b373b214dd4e6fcee66fdc737ef8d8","worker_digest":"0bc89497a3397756e70419b2184181e33a7374a9c6deda9a9d62e79c8a30b584"},"schema_version":"optimization.result/0.2","status":"completed","work":{"evaluations":100,"validation_evaluations":1},"worker":"fcmaes"},"payload_schema":"fcmaes.retry/1","status":"succeeded","step":"bite-default-4ff289a255a2ac75","template":"bite-default","worker":"fcmaes"},{"acceptance":{},"axes":{"/payload/seed":2},"error":null,"job_id":"a5f8f9113a72abe2ec2e774bd0726313","job_state":"completed","kind":"optimization","native":{"artifacts":{"results":"results.jsonl"},"completed_tasks":1,"elapsed_seconds":0.043038516,"known_work_lower_bound":{"evaluations":100,"validation_evaluations":1},"payload_schema":"fcmaes.retry/1","requested_tasks":1,"results":[{"elapsed_seconds":0.001945819,"outcome":{"claim":"best_found","details":{"evaluation_limit_mode":"hard","global_optimum_certified":false,"requested_evaluations":100,"run_seed":4646201506935093709},"evidence":{"checks":["objective","bounds"],"level":"rechecked"},"feasible":true,"objective":5.371136384479315e-06,"termination":"evaluation_limit","x":[-0.001638770329313921,-0.001638770329313921]},"spec_digest":"e4520fc9a7c2c5bfa0e518054eb52363a5d9ce09354948f599df5d984f4cd51a","task_id":0,"work":{"evaluations":100,"validation_evaluations":1}}],"runner":{"accounting_complete":true,"artifact_index":{"results":{"bytes":714,"description":"The result journal: one checked record per completed task","file":"results.jsonl","format":"records","sha256":"16e5364fb05d8b357f9156886e82c9b700706e81e5fd5639b8fc7c808215be31"}},"attempt_id":"a5f8f9113a72abe2ec2e774bd0726313","build":{"engine_version":"0.2.1","job_api_version":"0.3.0"},"profile":"optimization.runner/0.1","recovery":"journal_only_no_resume","resources":{"cpu_slots":1,"inner_threads":1,"outer_workers":1},"spec_digest":"e4520fc9a7c2c5bfa0e518054eb52363a5d9ce09354948f599df5d984f4cd51a","worker_digest":"0bc89497a3397756e70419b2184181e33a7374a9c6deda9a9d62e79c8a30b584"},"schema_version":"optimization.result/0.2","status":"completed","work":{"evaluations":100,"validation_evaluations":1},"worker":"fcmaes"},"payload_schema":"fcmaes.retry/1","status":"succeeded","step":"bite-default-982329a8aa3b0d15","template":"bite-default","worker":"fcmaes"},{"acceptance":{},"axes":{"/payload/seed":1},"error":null,"job_id":"3ec8af10b895981e2893ff1f6c3919ea","job_state":"completed","kind":"optimization","native":{"artifacts":{"results":"results.jsonl"},"completed_tasks":1,"elapsed_seconds":0.040236428,"known_work_lower_bound":{"evaluations":100,"validation_evaluations":1},"payload_schema":"fcmaes.retry/1","requested_tasks":1,"results":[{"elapsed_seconds":0.000631562,"outcome":{"claim":"best_found","details":{"evaluation_limit_mode":"hard","global_optimum_certified":false,"requested_evaluations":100,"run_seed":7179163421162001120},"evidence":{"checks":["objective","bounds"],"level":"rechecked"},"feasible":true,"objective":0.011643188766312476,"termination":"evaluation_limit","x":[0.09381334298071842,0.053312713728477235]},"spec_digest":"592591a600471d4ae3285b6ff7484cca3e381348ff7a23676ae1ba80140c82cd","task_id":0,"work":{"evaluations":100,"validation_evaluations":1}}],"runner":{"accounting_complete":true,"artifact_index":{"results":{"bytes":711,"description":"The result journal: one checked record per completed task","file":"results.jsonl","format":"records","sha256":"9421b83de13ce5551cba10abf69f0fc2f4ea8f1a578bc8e5a31a3061d9192fe8"}},"attempt_id":"3ec8af10b895981e2893ff1f6c3919ea","build":{"engine_version":"0.2.1","job_api_version":"0.3.0"},"profile":"optimization.runner/0.1","recovery":"journal_only_no_resume","resources":{"cpu_slots":1,"inner_threads":1,"outer_workers":1},"spec_digest":"592591a600471d4ae3285b6ff7484cca3e381348ff7a23676ae1ba80140c82cd","worker_digest":"0bc89497a3397756e70419b2184181e33a7374a9c6deda9a9d62e79c8a30b584"},"schema_version":"optimization.result/0.2","status":"completed","work":{"evaluations":100,"validation_evaluations":1},"worker":"fcmaes"},"payload_schema":"fcmaes.retry/1","status":"succeeded","step":"bite-default-f710263e96bda59b","template":"bite-default","worker":"fcmaes"},{"acceptance":{},"axes":{"/payload/seed":3},"error":null,"job_id":"3037e511f48b4bb5538d0f9175feb83d","job_state":"completed","kind":"optimization","native":{"artifacts":{"results":"results.jsonl"},"completed_tasks":1,"elapsed_seconds":0.045054715,"known_work_lower_bound":{"evaluations":100,"validation_evaluations":1},"payload_schema":"fcmaes.retry/1","requested_tasks":1,"results":[{"elapsed_seconds":0.004645255,"outcome":{"claim":"best_found","details":{"evaluation_limit_mode":"hard","global_optimum_certified":false,"requested_evaluations":100,"run_seed":14384468101657658870},"evidence":{"checks":["objective","bounds"],"level":"rechecked"},"feasible":true,"objective":0.0017241732654608498,"termination":"evaluation_limit","x":[0.018886154157740975,-0.03697954091914735]},"spec_digest":"af561faf0e5ce1bc595f85cf34d35df2284fcae9e7ef49b681978060a9c2501c","task_id":0,"work":{"evaluations":100,"validation_evaluations":1}}],"runner":{"accounting_complete":true,"artifact_index":{"results":{"bytes":714,"description":"The result journal: one checked record per completed task","file":"results.jsonl","format":"records","sha256":"cebd8db5b5dcaf3884fa17ac9e3f05aa9d468cdd92ad6c06d16b84686c67d815"}},"attempt_id":"3037e511f48b4bb5538d0f9175feb83d","build":{"engine_version":"0.2.1","job_api_version":"0.3.0"},"profile":"optimization.runner/0.1","recovery":"journal_only_no_resume","resources":{"cpu_slots":1,"inner_threads":1,"outer_workers":1},"spec_digest":"af561faf0e5ce1bc595f85cf34d35df2284fcae9e7ef49b681978060a9c2501c","worker_digest":"0bc89497a3397756e70419b2184181e33a7374a9c6deda9a9d62e79c8a30b584"},"schema_version":"optimization.result/0.2","status":"completed","work":{"evaluations":100,"validation_evaluations":1},"worker":"fcmaes"},"payload_schema":"fcmaes.retry/1","status":"succeeded","step":"bite-larger-4ff289a255a2ac75","template":"bite-larger","worker":"fcmaes"},{"acceptance":{},"axes":{"/payload/seed":2},"error":null,"job_id":"cb33b8a4b39f7dd10f11d4663d90d4a8","job_state":"completed","kind":"optimization","native":{"artifacts":{"results":"results.jsonl"},"completed_tasks":1,"elapsed_seconds":0.048977127,"known_work_lower_bound":{"evaluations":100,"validation_evaluations":1},"payload_schema":"fcmaes.retry/1","requested_tasks":1,